{
  "schema_version": "1.0.0",
  "plan_id": "docvault-lasttime-fusion-v0.1",
  "app_id": "docvault-lasttime-fusion",
  "release_train": "DOCVAULT_LASTTIME_V0_1_INSTALLABLE",
  "product_blueprint_sha256": "2120f5989ec35562377bd42e032018bd0004916d5ea4c56005f8e7048414b6fc",
  "status": "PAUSED",
  "scope_lock": {
    "included": [
      "encrypted document create, restart, search, and reopen",
      "LastTime activity, cadence, reminder, restart, and timezone behavior",
      "typed cross-module document-activity links and federated search",
      "minimum usable Android and iOS application shells"
    ],
    "deferred": [
      "scanner and OCR",
      "PDF editing or export",
      "office suite",
      "cloud sync and accounts",
      "memory graph",
      "new input applications",
      "signed store distribution without credentials"
    ],
    "new_capability_policy": "SCORE_THEN_INCLUDE_REPLACE_COMBINE_BACKLOG_REJECT_OR_INCONCLUSIVE"
  },
  "user_journeys": [
    {
      "journey_id": "J1",
      "title": "Create an encrypted document, restart, find it, and reopen it",
      "status": "IN_PROGRESS",
      "acceptance_criteria": [
        {
          "criterion_id": "J1_ANDROID_UI",
          "statement": "The Android app completes the journey through its installed UI after a process-style restart.",
          "evidence_kind": "UI_TEST",
          "status": "PASS"
        },
        {
          "criterion_id": "J1_IOS_UI",
          "statement": "The iOS simulator app completes the journey through its installed UI after relaunch.",
          "evidence_kind": "UI_TEST",
          "status": "NOT_STARTED"
        },
        {
          "criterion_id": "J1_CRYPTO",
          "statement": "Stored document bytes are encrypted, context-bound, integrity checked, and readable after restart.",
          "evidence_kind": "CONTRACT_TEST",
          "status": "PASS"
        },
        {
          "criterion_id": "J1_SEARCH",
          "statement": "Only authorized verified active metadata is searchable and opens the intended document.",
          "evidence_kind": "CONTRACT_TEST",
          "status": "PASS"
        }
      ]
    },
    {
      "journey_id": "J2",
      "title": "Record activity, derive cadence, schedule a reminder, and survive restart and timezone change",
      "status": "NOT_STARTED",
      "acceptance_criteria": [
        {
          "criterion_id": "J2_SHARED",
          "statement": "Deterministic shared contracts prove activity, cadence, scheduling, restart, and timezone behavior.",
          "evidence_kind": "CONTRACT_TEST",
          "status": "NOT_STARTED"
        },
        {
          "criterion_id": "J2_ANDROID_UI",
          "statement": "The installed Android app completes the activity and reminder journey.",
          "evidence_kind": "UI_TEST",
          "status": "NOT_STARTED"
        },
        {
          "criterion_id": "J2_IOS_UI",
          "statement": "The installed iOS simulator app completes the activity and reminder journey.",
          "evidence_kind": "UI_TEST",
          "status": "NOT_STARTED"
        }
      ]
    },
    {
      "journey_id": "J3",
      "title": "Link a document to an activity and find both through federated search",
      "status": "NOT_STARTED",
      "acceptance_criteria": [
        {
          "criterion_id": "J3_SHARED",
          "statement": "Typed links and federated search are deterministic and authorization preserving.",
          "evidence_kind": "CONTRACT_TEST",
          "status": "NOT_STARTED"
        },
        {
          "criterion_id": "J3_ANDROID_UI",
          "statement": "The installed Android app creates a typed link and opens both linked records from search.",
          "evidence_kind": "UI_TEST",
          "status": "NOT_STARTED"
        },
        {
          "criterion_id": "J3_IOS_UI",
          "statement": "The installed iOS simulator app creates a typed link and opens both linked records from search.",
          "evidence_kind": "UI_TEST",
          "status": "NOT_STARTED"
        }
      ]
    }
  ],
  "deliverables": [
    {
      "artifact_kind": "ANDROID_DEBUG_APK",
      "required_for_train": true,
      "status": "PASS",
      "evidence": [
        "Product CI run 33749114136; artifact 9890952602; androidApp-debug.apk; SHA-256 9398df8ab497ffa6ef309bd2b6ef5638143c8877f75a8e27e694a8a7628a5ffb.",
        "Android J1 local fallback PASS at source 99e3e83bbbe92406b9010b56c9da05e8b8f0fea7; APK SHA-256 733f0bebdc48260efc4c53fe4dd1e45415353d3af0b4036466c218e967613137; Drive https://drive.google.com/file/d/1o2zUqBzq_dVmKk9RRbvZfYf4aQ86BDrH/view."
      ]
    },
    {
      "artifact_kind": "ANDROID_RELEASE_APK",
      "required_for_train": true,
      "status": "IN_PROGRESS",
      "evidence": [
        "Product CI run 33749114136 produced androidApp-release-unsigned.apk; SHA-256 d66d256040fe0ca9263431a734d08a54d8dc8312a996eacc5db0aaf5e06ee4f8. Signing and installed release validation remain outstanding."
      ]
    },
    {
      "artifact_kind": "ANDROID_AAB",
      "required_for_train": true,
      "status": "IN_PROGRESS",
      "evidence": [
        "Product CI run 33749114136 produced androidApp-release.aab; SHA-256 e3e6d86e470d24b323e01654232fba3404b93694dbc4093be8f60f7110838b50. Distribution signing remains outstanding."
      ]
    },
    {
      "artifact_kind": "IOS_SIMULATOR_APP",
      "required_for_train": true,
      "status": "PASS",
      "evidence": [
        "Product CI run 33749114136; artifact 9891032519; AppFusion-ios-simulator.zip; SHA-256 e85d797d93d3ce417e411eb551b77c3c81a2ea56128ab2fd8f013aff34eca4d7."
      ]
    },
    {
      "artifact_kind": "IOS_ARCHIVE",
      "required_for_train": false,
      "status": "DEFERRED",
      "evidence": [
        "Requires Apple signing credentials and provisioning not currently authorized."
      ]
    },
    {
      "artifact_kind": "SOURCE_ZIP",
      "required_for_train": true,
      "status": "PASS",
      "evidence": [
        "Product merge f1100e8907a5a0101b19a20452928335b478bdc9; source ZIP SHA-256 c8c058605cd09b6c57a6b836b317bfaf0262d4e360cb30118ab8ad30a0e2e12a; Drive https://drive.google.com/file/d/1Zu-VIGNOH_tOVjliCslSwd94wu11qNpl/view."
      ]
    },
    {
      "artifact_kind": "TEST_REPORT",
      "required_for_train": true,
      "status": "IN_PROGRESS",
      "evidence": [
        "Android slice: 25 JVM contracts, 4 emulator runtime tests, 8 Python tests, and installed J1 passed. Cross-platform report remains incomplete. Evidence https://drive.google.com/file/d/1c49tfSJozfdrg3ohd7kbzI1J0SViql43/view."
      ]
    },
    {
      "artifact_kind": "SECURITY_REPORT",
      "required_for_train": true,
      "status": "NOT_STARTED",
      "evidence": []
    },
    {
      "artifact_kind": "SCREENSHOTS",
      "required_for_train": true,
      "status": "IN_PROGRESS",
      "evidence": [
        "Android J1 final screenshot visually verified: https://drive.google.com/file/d/1F-_lWIb9I-mKpmTgceF2EaZSU6ej2pcL/view. iOS and remaining journeys are outstanding."
      ]
    },
    {
      "artifact_kind": "CHECKSUMS",
      "required_for_train": true,
      "status": "IN_PROGRESS",
      "evidence": [
        "Android milestone 010 snapshot checksums: https://drive.google.com/file/d/1gFqiOk4cjph8ejfiqQ0J9dMrFylzxO71/view. Final cross-platform release checksum set remains outstanding."
      ]
    }
  ],
  "defects": [
    {
      "defect_id": "ANDROID_ROOM_ABI_COMPILE",
      "severity": "HIGH",
      "status": "FIXED",
      "summary": "The Android shell initially lacked Room runtime and bundled SQLite ABI dependencies; repair attempt 1 added the required compile/runtime dependencies and the complete construction run passed."
    },
    {
      "defect_id": "ANDROID_SYSTEM_BAR_OVERLAP",
      "severity": "MEDIUM",
      "status": "FIXED",
      "summary": "Visual inspection of the first installed J1 pass found header/status-bar overlap; platform insets were applied and the complete installed journey passed again."
    }
  ],
  "loop_controls": {
    "max_consecutive_infrastructure_milestones": 2,
    "max_repair_attempts_per_failure_signature": 2,
    "max_audits_without_new_evidence": 1,
    "first_installable_artifact_deadline_milestone": 9,
    "on_limit": "FORCE_DELIVERY_SLICE_OR_PAUSE"
  },
  "ci_policy": {
    "tiers": [
      "TIER_0",
      "TIER_1",
      "TIER_2",
      "TIER_3"
    ],
    "expensive_jobs_require_preflight": true,
    "paid_overage_authorized": false
  },
  "terminal_condition": {
    "required_journey_ids": [
      "J1",
      "J2",
      "J3"
    ],
    "required_artifact_kinds": [
      "ANDROID_DEBUG_APK",
      "ANDROID_RELEASE_APK",
      "ANDROID_AAB",
      "IOS_SIMULATOR_APP",
      "SOURCE_ZIP",
      "TEST_REPORT",
      "SECURITY_REPORT",
      "SCREENSHOTS",
      "CHECKSUMS"
    ],
    "zero_critical_defects": true
  },
  "updated_at": "2026-09-04T02:46:15Z"
}
